{
  "allocationPath": "fixtures/allocations/campaign-v1.json",
  "allocationSha256": "fb6c30ebf31f957a635a92a46a63bc04fdbc7f1601253f6972519477f5c5cc34",
  "budget": "1000",
  "campaignId": "fixture-community-one",
  "campaignManifestPath": "fixtures/campaigns/campaign-v1.json",
  "campaignManifestSha256": "fab14438bfbd2b4acb96bac49ca4bbdf2e2df9512bf63cebee53d142dfff0b8d",
  "cluster": "devnet",
  "distributed": "1000",
  "fixture": true,
  "reconciledAt": "2026-08-23T00:05:00Z",
  "reconciliationId": "fixture-community-one-final",
  "recordType": "reconciliation",
  "schemaVersion": 1,
  "status": "COMPLETE",
  "transactions": [
    {
      "amount": "1000",
      "finalizedSlot": "110",
      "signature": "3333333333333333333333333333333333333333333333333333333333333333333333333333333333333333"
    }
  ],
  "unclaimed": "0"
}
